{"$schema":"https://json-schema.org/draft/2020-12/schema","type":"object","required":["schemaVersion","generatedAt","frameworkId","cardCount","activeCardCount","cards","tags","types","indexSha256"],"properties":{"schemaVersion":{"const":"1.0.0"},"generatedAt":{"type":"string","format":"date-time"},"frameworkId":{"type":"string"},"cardCount":{"type":"integer"},"activeCardCount":{"type":"integer"},"cards":{"type":"array","items":{"type":"object"}},"tags":{"type":"array","items":{"type":"string"}},"types":{"type":"array","items":{"type":"string"}},"indexSha256":{"type":"string","pattern":"^[a-f0-9]{64}$"}}}
